{
  "schema_version": 1,
  "source": {
    "name": "熊本秘密クラブ 開催情報BLOG",
    "rss_url": "https://kumamotosecretclub.jp/blog2/rss.xml",
    "site_url": "https://kumamotosecretclub.jp/",
    "blog_url": "https://kumamotosecretclub.jp/blog2/"
  },
  "generated_at": "2026-08-13T02:46:33+09:00",
  "status": "no_current_event",
  "current_event": null,
  "recent_items": [
    {
      "title": "🎭 8月12日（水）熊本・上通りにて開催します",
      "published_at": "2026-08-12T23:00:00+09:00",
      "updated_at": null,
      "event_date": "2026-08-12",
      "event_time": null,
      "area": "上通周辺",
      "summary": "午後からスタートし、明け方までゆっくりと続く一日。 仮面の奥で、日常の肩書きや役割を少し休ませながら、それぞれのペースで会話や交流を楽しむ時間です",
      "status": "finished",
      "url": "https://kumamotosecretclub.jp/blog2/2026-08-12.html",
      "source_type": "rss"
    },
    {
      "title": "🎭 7月30日（木） 西銀座通り BAR開催",
      "published_at": "2026-07-31T05:00:00+09:00",
      "updated_at": null,
      "event_date": "2026-07-30",
      "event_time": null,
      "area": "西銀座通り周辺",
      "summary": "最初はカラオケ女子会からスタート🎤 途中からも参加OKの通常開催に切り替わる予定です",
      "status": "finished",
      "url": "https://kumamotosecretclub.jp/blog2/2026-07-30.html",
      "source_type": "rss"
    },
    {
      "title": "🎤7月28日（火）21:00〜23:00",
      "published_at": "2026-07-29T06:00:00+09:00",
      "updated_at": null,
      "event_date": "2026-07-28",
      "event_time": "21:00",
      "area": "西銀座通り周辺",
      "summary": "西銀座通りのBARで熊本秘密クラブをプレ開催🎭",
      "status": "finished",
      "url": "https://kumamotosecretclub.jp/blog2/2026-07-28.html",
      "source_type": "rss"
    },
    {
      "title": "7月24日（金）の夜から明け方にかけて、 熊本・上通りエリアにて開催します",
      "published_at": "2026-07-25T02:00:00+09:00",
      "updated_at": null,
      "event_date": "2026-07-24",
      "event_time": null,
      "area": "上通周辺",
      "summary": "街の灯りが深くなる頃、 仮面をまとって、いつもの日常を少しだけ離れる夜",
      "status": "finished",
      "url": "https://kumamotosecretclub.jp/blog2/2026-07-24.html",
      "source_type": "rss"
    }
  ]
}
